{
  "font": {
    "name": "Geist Mono",
    "links": [
      "https://vercel.com/font"
    ],
    "license": "open"
  },
  "theme": {
    "name": "Aura Dark",
    "links": [
      "https://github.com/daltonmenezes/aura-theme"
    ],
    "license": "open",
    "appearance": "dark"
  },
  "author": {
    "name": "ahmedsomaa",
    "url": "https://github.com/ahmedsomaa"
  },
  "snapshot": "geist-mono--aura-dark.png",
  "editors": [
    {
      "id": "vscode",
      "settings": "{\n  \"editor.fontFamily\": \"Geist Mono\",\n  \"editor.fontSize\": 14,\n  \"editor.fontWeight\": \"400\",\n  \"editor.lineHeight\": 1.5,\n  \"editor.fontLigatures\": true,\n  \"workbench.colorTheme\": \"Aura Dark\"\n}"
    },
    {
      "id": "zed",
      "settings": "{\n  \"buffer_font_family\": \"Geist Mono\",\n  \"buffer_font_size\": 14,\n  \"buffer_font_weight\": 400,\n  \"buffer_line_height\": {\n    \"custom\": 1.5\n  },\n  \"buffer_font_features\": {\n    \"calt\": true\n  },\n  \"theme\": \"Aura Dark\"\n}"
    }
  ]
}
