{
  "font": {
    "name": "Fira Code",
    "links": [
      "https://github.com/tonsky/FiraCode"
    ],
    "license": "open"
  },
  "theme": {
    "name": "Palenight Theme",
    "links": [
      "https://github.com/whizkydee/vscode-palenight-theme"
    ],
    "license": "open",
    "appearance": "dark"
  },
  "author": {
    "name": "ahmedsomaa",
    "url": "https://github.com/ahmedsomaa"
  },
  "snapshot": "fira-code--palenight-theme.png",
  "editors": [
    {
      "id": "vscode",
      "settings": "{\n  \"editor.fontFamily\": \"Fira Code\",\n  \"editor.fontSize\": 14,\n  \"editor.fontWeight\": \"400\",\n  \"editor.lineHeight\": 1.5,\n  \"editor.fontLigatures\": true,\n  \"workbench.colorTheme\": \"Palenight Theme\"\n}"
    },
    {
      "id": "zed",
      "settings": "{\n  \"buffer_font_family\": \"Fira Code\",\n  \"buffer_font_size\": 14,\n  \"buffer_font_weight\": 400,\n  \"buffer_line_height\": {\n    \"custom\": 1.5\n  },\n  \"buffer_font_features\": {\n    \"calt\": true\n  },\n  \"theme\": \"Palenight Theme\"\n}"
    }
  ]
}
