{
  "font": {
    "name": "Zed Mono",
    "links": [
      "https://github.com/zed-industries/zed-fonts"
    ],
    "license": "open"
  },
  "theme": {
    "name": "Gruvbox Light Hard",
    "links": [
      "https://github.com/morhetz/gruvbox"
    ],
    "license": "open",
    "appearance": "light"
  },
  "author": {
    "name": "ahmedsomaa",
    "url": "https://github.com/ahmedsomaa"
  },
  "snapshot": "zed-mono--gruvbox-light-hard.png",
  "editors": [
    {
      "id": "vscode",
      "settings": "{\n  \"editor.fontFamily\": \"Zed Mono\",\n  \"editor.fontSize\": 14,\n  \"editor.fontWeight\": \"400\",\n  \"editor.lineHeight\": 1.5,\n  \"editor.fontLigatures\": true,\n  \"workbench.colorTheme\": \"Gruvbox Light Hard\"\n}"
    },
    {
      "id": "zed",
      "settings": "{\n  \"buffer_font_family\": \"Zed Mono\",\n  \"buffer_font_size\": 14,\n  \"buffer_font_weight\": 400,\n  \"buffer_line_height\": {\n    \"custom\": 1.5\n  },\n  \"buffer_font_features\": {\n    \"calt\": true\n  },\n  \"theme\": \"Gruvbox Light Hard\"\n}"
    }
  ]
}
